{
  "$schema": "schema/sensor.schema.json",
  "uuid": "ba575c02-eca0-11ec-8ea0-1337ac062022",
  "description": "Напряжение + Сила тока",
  "info": {
    "title": "Напряжение и ток",
    "sortOrder": -1
  },
  "yAxis": [
    {
      "unit": " В",
      "title": "Напряжение",
      "range": {
        "list": [
          {
            "min": -2.0,
            "max": 2.0,
            "precision": 1,
            "factor": "NORMAL",
            "calibrationPointsMin": 0
          },
          {
            "min": -5.0,
            "max": 5.0,
            "precision": 2,
            "factor": "NORMAL",
            "calibrationPointsMin": 2
          },
          {
            "min": -10.0,
            "max": 10.0,
            "precision": 2,
            "factor": "NORMAL",
            "calibrationPointsMin": 2
          },
          {
            "min": -15.0,
            "max": 15.0,
            "precision": 2,
            "factor": "NORMAL",
            "calibrationPointsMin": 2
          },
          {
            "min": -20.0,
            "max": 20.0,
            "precision": 2,
            "factor": "NORMAL",
            "calibrationPointsMin": 2
          }
        ],
        "defaultIndex": 0
      }
    },
    {
      "unit": " А",
      "title": "Сила тока",
      "range": {
        "list": [
          {
            "min": -1.0,
            "max": 1.0,
            "precision": 0,
            "factor": "NORMAL",
            "calibrationPointsMin": 0
          },
          {
            "min": -5.0,
            "max": 5.0,
            "precision": 3,
            "factor": "NORMAL",
            "calibrationPointsMin": 0
          }
        ],
        "defaultIndex": 0
      }
    }
  ],
  "value": [
    {
      "title": null,
      "options": [
        "chart",
        "gauge",
        "current",
        "measurements"
      ],
      "yAxisIndex": 0,
      "errors": {
        "0": "Нет ошибки",
        "1": "Датчик не подключен"
      }
    },
    {
      "title": null,
      "options": [
        "chart",
        "gauge",
        "current",
        "measurements"
      ],
      "yAxisIndex": 1,
      "errors": {
        "0": "Нет ошибки",
        "1": "Датчик не подключен"
      }
    }
  ]
}
