{
  "$schema": "schema/sensor.schema.json",
  "uuid": "ba575016-eca0-11ec-8ea0-1337ac062022",
  "description": "Датчик влажности почвы",
  "info": {
    "title": "Влажность почвы",
    "sortOrder": -1
  },
  "yAxis": [
    {
      "unit": "%",
      "title": "Влажность",
      "range": {
        "list": [
          {
            "min": 0.0,
            "max": 100.0,
            "precision": 0,
            "factor": "NORMAL",
            "calibrationPointsMin": 1
          }
        ],
        "defaultIndex": 0
      }
    }
  ],
  "value": [
    {
      "title": null,
      "options": [
        "chart",
        "gauge",
        "current",
        "measurements"
      ],
      "yAxisIndex": 0,
      "errors": {
        "0": "Нет ошибки",
        "1": "Датчик не подключен"
      }
    }
  ]
}
