{
  "$schema": "schema/sensor.schema.json",
  "uuid": "ba575019-eca0-11ec-8ea0-1337ac062022",
  "description": "Измеритель расстояния",
  "info": {
    "title": "Расстояние",
    "sortOrder": -1
  },
  "yAxis": [
    {
      "unit": "м",
      "title": "Расстояние",
      "range": {
        "list": [
          {
            "min": 0.0,
            "max": 4.0,
            "precision": 2,
            "factor": "NORMAL",
            "calibrationPointsMin": 2
          },
          {
            "min": 0.0,
            "max": 2.0,
            "precision": 2,
            "factor": "NORMAL",
            "calibrationPointsMin": 0
          }
        ],
        "defaultIndex": 1
      }
    }
  ],
  "value": [
    {
      "title": "Расстояние",
      "options": [
        "chart",
        "gauge",
        "current",
        "measurements"
      ],
      "yAxisIndex": 0,
      "errors": {
        "0": "Нет ошибки",
        "1": "Датчик не подключен"
      }
    }
  ]
}
