{
  "$schema": "schema/sensor.schema.json",
  "uuid": "ba575012-eca0-11ec-8ea0-1337ac062022",
  "description": "Электрокардиограмма",
  "info": {
    "title": "Электрокардиограмма",
    "sortOrder": -1
  },
  "yAxis": [
    {
      "unit": "В",
      "title": "ЭКГ",
      "range": {
        "list": [
          {
            "min": 0.0,
            "max": 3.0,
            "precision": 2,
            "factor": "MILLI",
            "calibrationPointsMin": 0
          }
        ],
        "defaultIndex": 0
      }
    },
    {
      "unit": "уд/мин",
      "title": "ЧСС",
      "range": {
        "list": [
          {
            "min": 0,
            "max": 300,
            "precision": 0,
            "factor": "NORMAL",
            "calibrationPointsMin": 0
          }
        ],
        "defaultIndex": 0
      }
    }
  ],
   "stage": [
    "Справочная информация. Приглашение начать измерения.",
    "Процесс измерения",
    "Получение данных",
    "Отображение результатов измерений"
  ],
  "value": [
    {
      "title": "ЭКГ",
      "options": [
        "chart"
      ],
      "yAxisIndex": 0,
      "errors": {
        "0": "Нет ошибки",
        "1": "Датчик не подключен"
      }
    },
    {
      "title": "ЧСС",
      "options": [
        "gauge"
      ],
      "yAxisIndex": 1,
      "errors": {
        "0": "Нет ошибки",
        "1": "Датчик не подключен"
      }
    }
  ]
}
