{
  "$schema": "schema/sensor.schema.json",
  "uuid": "ba575004-eca0-11ec-8ea0-1337ac062022",
  "description": "Освещенность",
  "info": {
    "title": "Уровень освещенности",
    "sortOrder": -1
  },
  "yAxis": [
    {
      "unit": " лк",
      "title": "Освещенность",
      "range": {
        "list": [
          {
            "min": 0.0,
            "max": 5000.0,
            "precision": 1,
            "factor": "NORMAL",
            "calibrationPointsMin": 2
          },
          {
            "min": 0.0,
            "max": 25000.0,
            "precision": 0,
            "factor": "NORMAL",
            "calibrationPointsMin": 0
          },
          {
            "min": 0.0,
            "max": 50000.0,
            "precision": 0,
            "factor": "NORMAL",
            "calibrationPointsMin": 0
          },
          {
            "min": 0.0,
            "max": 188000.0,
            "precision": 1,
            "factor": "KILO",
            "calibrationPointsMin": 0
          }
        ],
        "defaultIndex": 0
      }
    }
  ],
  "value": [
    {
      "title": null,
      "options": [
        "chart",
        "gauge",
        "current",
        "measurements"
      ],
      "yAxisIndex": 0,
      "errors": {
        "0": "Нет ошибки",
        "1": "Датчик не подключен"
      }
    }
  ]
}
